date,ranking,title,writer,press,kategorie
202312,120,아주 작은 습관의 힘,"제임스 클리어 지음, 이한이 옮김",비즈니스북스,자기계발
202203,120,도쿄 리벤저스 22,와쿠이 켄 지음,학산문화사(만화),만화
202204,120,스파이 패밀리 6,엔도 타츠야 지음,학산문화사(만화),만화
202205,120,지구가 죽으면 달은 누굴 돌지?,김혜순 지음,문학과지성사,소설/시/희곡
202206,120,거의 모든 전쟁의 역사,"제러미 블랙 지음, 유나영 옮김",서해문집,역사
202207,120,주술회전 19,"아쿠타미 게게 지음, 이정운 옮김",서울미디어코믹스(서울문화사),만화
202208,120,두더지의 여름,김상근 지음,사계절,유아
202209,120,이야기의 핵심,"리비 호커 지음, 안은주 옮김",한즈미디어(한스미디어),인문학
202210,120,흔한남매 이상한 나라의 고전 읽기 2,"정주연 그림, 최재훈 글, 흔한남매 외 감수",미래엔아이세움,어린이
202211,120,"오늘 밤, 세계에서 이 사랑이 사라진다 해도","이치조 미사키 지음, 권영주 옮김",모모,소설/시/희곡
202212,120,22똥괭이네 스티커북,대원앤북 편집부 지음,대원앤북,유아
202401,121,도쿄 리벤저스 : 바지 케이스케로부터의 편지 2,"나츠카와구치 유키노리 지음, 와쿠이 켄 원작",학산문화사(만화),만화
202402,121,용선생 교과서 세계사 2,"사회평론 역사연구소 지음, 뭉선생 그림, 전국초등사회교과모임 감수, 이우일 캐릭터",사회평론,어린이
202301,121,코스모스,"칼 세이건 지음, 홍승수 옮김",사이언스북스,과학
202302,121,데일리 필로소피,"라이언 홀리데이.스티븐 핸슬먼 지음, 장원철 옮김",다산초당(다산북스),인문학
202303,121,읽으면서 바로 써먹는 어린이 맞춤법 행성,한날 지음,파란정원,어린이
202304,121,슬램덩크 신장재편판 2,이노우에 타케히코 지음,대원씨아이(만화),만화
202305,121,데일 카네기 인간관계론 (무삭제 완역본),"데일 카네기 지음, 임상훈 옮김",현대지성,자기계발
202306,121,더티 워크,"이얼 프레스 지음, 오윤성 옮김",한겨레출판,사회과학
202307,121,원피스 105,오다 에이치로 지음,대원씨아이(만화),만화
202308,121,내 마음의 위험한 녀석 8 (일러스트 카드 2종 + 양면 커버 + 소책자 포함 한정판),"사쿠라이 노리오 지음, 조원로 옮김",㈜소미미디어,만화
202309,121,"안녕, 에리",후지모토 타츠키 지음,학산문화사(만화),만화
202310,121,해님 달님 떡집,"김리리 지음, 김이랑 그림",비룡소,어린이
202311,121,초등 미니 논술 일력 365 (스프링),오현선 지음,서사원주니어,어린이
202312,121,고통을 말하지 않는 법,"마리아 투마킨 지음, 서제인 옮김",을유문화사,인문학
202203,121,미드나잇 라이브러리,"매트 헤이그 지음, 노진선 옮김",인플루엔셜(주),소설/시/희곡
202204,121,스파이 패밀리 5,엔도 타츠야 지음,학산문화사(만화),만화
202205,121,가끔씩 툭하고 러시아어로 부끄러워하는 옆자리의 아랴 양 1,"SUN SUN SUN 지음, 모모코 그림, 이승원 옮김",디앤씨미디어(주)(D&C미디어),소설/시/희곡
202206,121,어른의 문해력,김선영 지음,블랙피쉬,인문학
202207,121,당신은 사건 현장에 있습니다,"모데스토 가르시아 지음, 하비 데 카스트로 그림, 엄지영 옮김",중앙books(중앙북스),건강/취미
202208,121,나의 히어로 아카데미아 34,호리코시 코헤이 지음,서울미디어코믹스(서울문화사),만화
202209,121,"칵테일, 러브, 좀비 (리커버)",조예은 지음,안전가옥,소설/시/희곡
202210,121,체인소 맨 10,후지모토 타츠키 지음,학산문화사(만화),만화
202211,121,부의 추월차선 (10주년 스페셜 에디션),"엠제이 드마코 지음, 신소영 옮김",토트,경제경영
202212,121,하나님의 숨결,김병삼 지음,두란노,종교/역학
202401,122,2024 에듀윌 스포츠지도사 필기 한권끝장+모의고사 3회분,정수봉 외 지음,에듀윌,수험서/자격증
202402,122,헤르만 헤세의 나로 존재하는 법,"헤르만 헤세 지음, 유영미 옮김",뜨인돌,인문학
202301,122,월간순정 노자키 군 14,츠바키 이즈미 지음,학산문화사(만화),만화
202302,122,파친코 2,"이민진 지음, 신승미 옮김",인플루엔셜(주),소설/시/희곡
202303,122,DO IT 두잇,데이비드 차 지음,아크,종교/역학
202304,122,최애의 아이 7,"아카사카 아카 지음, 요코야리 멘고 그림",대원씨아이(만화),만화
202305,122,일본산고,박경리 지음,다산책방,에세이
202306,122,최애의 아이 5,"아카사카 아카 지음, 요코야리 멘고 그림",대원씨아이(만화),만화
202307,122,최애의 아이 6,"아카사카 아카 지음, 요코야리 멘고 그림",대원씨아이(만화),만화
202308,122,누구도 나를 파괴할 수 없다,"데이비드 고긴스 지음, 이영래 옮김",웅진지식하우스,자기계발
202309,122,이웃집 스텔라 1,"Ammitsu 지음, 이소연 옮김",서울미디어코믹스(서울문화사),만화
202310,122,괴수 8호 10 (초판한정 키코루 일러스트 카드 2종 + 선착순 한정 스페셜 일러스트 카드 1종 포함 특장판),"마츠모토 나오야 지음, 유유리 옮김",서울미디어코믹스(서울문화사),만화
202311,122,영혼이 강한 아이로 키워라,조선미 지음,북하우스,좋은부모
202312,122,ETS 토익기출 파트별 VOCA 보카,ETS 지음,(주)YBM(와이비엠),외국어
202203,122,메멘토 모리,"이어령 지음, 김태완 엮음",열림원,인문학
202204,122,우리는 여전히 삶을 사랑하는가,"에리히 프롬 지음, 라이너 풍크 엮음, 장혜경 옮김",김영사,인문학
202205,122,기븐 7,키즈 나츠키 지음,현대지능개발사,만화
202206,122,해커스 토익 RC 리딩 READING,데이빗 조 (David Cho) 지음,해커스어학연구소(Hackers),외국어
202207,122,가장 좋은 것을 너에게 줄게,"정여울 지음, 이승원 사진",이야기장수,에세이
202208,122,설민석의 삼국지 대모험 8,"단꿈아이 지음, 스튜디오 담 그림",단꿈아이,어린이
202209,122,러버즈 하이 2,"안자이 카린 지음, 심이슬 옮김, MICHIRU EIDUKA 원작",서울미디어코믹스(서울문화사),만화
202210,122,얼굴만으론 좋아할 수 없어요 5,"안자이 카린 지음, 이소연 옮김",서울미디어코믹스(서울문화사),만화
202211,122,한경아르떼 합스부르크 600년 매혹의 걸작들 100배 즐기기,한경arte 특별취재팀 지음,한국경제신문,예술/대중문화
202212,122,재벌집 막내아들 4,산경 지음,테라코타,소설/시/희곡
202401,123,웡카,"시빌 파운더 글, 김난령 옮김, 사이먼 파너비 각본, 폴 킹 시나리오",시공주니어,어린이
202402,123,내가 원하는 곳에 나를 데려가라,"네빌 고다드 지음, 김은영 옮김",터닝페이지,자기계발
202301,123,부의 추월차선 (10주년 스페셜 에디션),"엠제이 드마코 지음, 신소영 옮김",토트,경제경영
202302,123,부자의 자세,제이원 지음,좋은연필,경제경영
202303,123,데일 카네기 인간관계론 (무삭제 완역본),"데일 카네기 지음, 임상훈 옮김",현대지성,자기계발
202304,123,슬램덩크 신장재편판 16,이노우에 타케히코 지음,대원씨아이(만화),만화
202305,123,만일 내가 인생을 다시 산다면 (30만 부 기념 스페셜 에디션),김혜남 지음,메이븐,인문학
202306,123,리얼리티 트랜서핑 1,"바딤 젤란드 지음, 박인수 옮김",정신세계사,자기계발
202307,123,다이어트 사이언스 2022,최겸 지음,린체인저스,건강/취미
202308,123,세계 끝의 버섯,"애나 로웬하웁트 칭 지음, 노고운 옮김",현실문화,인문학
202309,123,잘못된 장소 잘못된 시간,"질리언 매캘리스터 지음, 이경 옮김",시옷북스,소설/시/희곡
202310,123,마흔에 읽는 쇼펜하우어,강용수 지음,유노북스,인문학
202311,123,이렇게 작가가 되었습니다,정아은 지음,마름모,인문학
202312,123,"설자은, 금성으로 돌아오다",정세랑 지음,문학동네,소설/시/희곡
202203,123,전념,"피트 데이비스 지음, 신유희 옮김",상상스퀘어,인문학
202204,123,도쿄 리벤저스 23,와쿠이 켄 지음,학산문화사(만화),만화
202205,123,감정 어휘,유선경 지음,앤의서재,인문학
202206,123,맛있어서 지속 가능한 디디미니 다이어트 레시피,미니 박지우 지음,빅피시,요리/살림
202207,123,소비단식 일기,서박하 지음,휴머니스트,에세이
202208,123,여름 키코,주하림 지음,문학동네,소설/시/희곡
202209,123,월급쟁이 부자로 은퇴하라 (10만 부 돌파 기념 증보판),너나위 지음,알에이치코리아(RHK),경제경영
202210,123,엄마의 말 연습,윤지영 지음,카시오페아,좋은부모
202211,123,내 최고의 하루는 오늘부터 시작된다,"브리애나 위스트 지음, 김영애 옮김",비즈니스북스,자기계발
202212,123,아주 작은 습관의 힘,"제임스 클리어 지음, 이한이 옮김",비즈니스북스,자기계발
202401,124,진짜 쓰는 실무 엑셀,오빠두(전진권) 지음,제이펍,컴퓨터/모바일
202402,124,봄의 폭풍과 몬스터 2,"미츠바치 미유키 지음, 이슬 옮김",학산문화사(만화),만화
202301,124,Stick 스틱! (15주년 기념판),"칩 히스.댄 히스 지음, 안진환.박슬라 옮김",웅진지식하우스,경제경영
202302,124,그릿 GRIT (골드 에디션),"앤절라 더크워스 지음, 김미정 옮김",비즈니스북스,자기계발
202303,124,2023 해커스 GSAT 삼성직무적성검사 통합 기본서 최신기출유형+실전모의고사 (수리논리/추리),해커스 취업교육연구소 지음,챔프스터디,수험서/자격증
202304,124,최애의 아이 6,"아카사카 아카 지음, 요코야리 멘고 그림",대원씨아이(만화),만화
202305,124,굿바이 코드네임,강경수 지음,시공주니어,어린이
202306,124,비가 오면 열리는 상점,유영광 지음,클레이하우스,소설/시/희곡
202307,124,모순,양귀자 지음,쓰다,소설/시/희곡
202308,124,나를 지키는 관계가 먼저입니다,안젤라 센 지음,쌤앤파커스,자기계발
202309,124,타키 포오 얼렁뚱땅 상식스쿨 1,"조수현 그림, 김언정 글, 정효해 감수, 캐릭온TV 원작",대원키즈,어린이
202310,124,담을 넘은 아이 (리커버 특별판),"김정민 지음, 이영환 그림",비룡소,어린이
202311,124,데미안 (오리지널 초판본 표지디자인),"헤르만 헤세 지음, 이미영 옮김, 김선형",코너스톤,소설/시/희곡
202312,124,2024 간호사 국가고시 5일 완성 파이널 모의고사,주선희.간호수험연구소 지음,홍지문,수험서/자격증
202203,124,헌팅턴비치에 가면 네가 있을까,이어령 지음,열림원,소설/시/희곡
202204,124,주식 멘토 김현구의 주식 잘 사고 잘 파는 법,김현구 지음,메이트북스,경제경영
202205,124,H마트에서 울다,"미셸 자우너 지음, 정혜윤 옮김",문학동네,에세이
202206,124,브라질에 비가 내리면 스타벅스 주식을 사라,"피터 나바로 지음, 이창식 옮김, 윤지호 감수",에프엔미디어,경제경영
202207,124,진짜 쓰는 실무 엑셀,오빠두(전진권) 지음,제이펍,컴퓨터/모바일
202208,124,다정한 것이 살아남는다,"브라이언 헤어.버네사 우즈 지음, 이민아 옮김, 박한선 감수",디플롯,과학
202209,124,10배의 법칙,"그랜트 카돈 지음, 최은아 옮김",부키,자기계발
202210,124,백년 허리 2 : 치료편,정선근 지음,언탱글링,건강/취미
202211,124,망그러진 만화,유랑 지음,좋은생각,에세이
202212,124,재벌집 막내아들 5,산경 지음,테라코타,소설/시/희곡
202401,125,듄 신장판 2,"프랭크 허버트 지음, 김승욱 옮김",황금가지,소설/시/희곡
202402,125,고전의 숲,김태완 지음,포레스트북스,청소년
202301,125,스즈메의 문단속,"신카이 마코토 지음, 민경욱 옮김",대원씨아이(단행본),소설/시/희곡
202302,125,가재가 노래하는 곳 (리커버 에디션),"델리아 오언스 지음, 김선형 옮김",살림,소설/시/희곡
202303,125,"오늘 밤, 세계에서 이 사랑이 사라진다 해도","이치조 미사키 지음, 권영주 옮김",모모,소설/시/희곡
202304,125,우다다 꽁냥파크,"권혁진 지음, 심보영 그림",비룡소,어린이
202305,125,아홉 살에 시작하는 똑똑한 초등신문,신효원 지음,책장속북스,어린이
202306,125,최애의 아이 3,"아카사카 아카 지음, 요코야리 멘고 그림",대원씨아이(만화),만화
202307,125,2023 Stima 면접 지방직 1,스티마 지음,혜음출판사,수험서/자격증
202308,125,유연함의 힘,"수잔 애쉬포드 지음, 김정혜 옮김",상상스퀘어,자기계발
202309,125,그릿 GRIT (골드 에디션),"앤절라 더크워스 지음, 김미정 옮김",비즈니스북스,자기계발
202310,125,연인 대본집 3,황진영 지음,김영사,예술/대중문화
202311,125,해적의 시대를 건너는 법,박웅현 지음,인티N,인문학
202312,125,레버리지 (20만 부 기념 블랙에디션),"롭 무어 지음, 김유미 옮김",다산북스,자기계발
202203,125,픽사 스토리텔링,"매튜 룬 지음, 박여진 옮김",현대지성,경제경영
202204,125,고민의 답,글배우 지음,강한별,자기계발
202205,125,10배의 법칙,"그랜트 카돈 지음, 최은아 옮김",부키,자기계발
202206,125,더 찬스 The Chance,김영익 지음,21세기북스,경제경영
202207,125,소설 보다 : 여름 2022,김지연.이미상.함윤이 지음,문학과지성사,소설/시/희곡
202208,125,사피엔스 (무선본),"유발 하라리 지음, 조현욱 옮김, 이태수 감수",김영사,인문학
202209,125,쇼타 형아 1,"나카야마 미유키 지음, 심이슬 옮김",서울미디어코믹스(서울문화사),만화
202210,125,대한민국 부동산 부의 역사,이상우.유성운 지음,포레스트북스,경제경영
202211,125,그레이트 리세션 2023년 경제전망,김광석 지음,지식노마드,경제경영
202212,125,부의 추월차선 (10주년 스페셜 에디션),"엠제이 드마코 지음, 신소영 옮김",토트,경제경영
202401,126,2024 단기 합격 해커스공기업 NCS 통합 기본서 직업기초능력평가+직무수행능력평가,윤종혁 외 지음,해커스공기업,수험서/자격증
202402,126,일본어 상용한자 무작정 따라하기 1,권경배 지음,길벗이지톡,외국어
202301,126,일생에 단 한번은 독기를 품어라,권민창 지음,마인드셋,자기계발
202302,126,거의 모든 일상 표현의 영어,케빈 강.해나 변 지음,사람in,외국어
202303,126,소설 보다 : 봄 2023,강보라.김나현.예소연 지음,문학과지성사,소설/시/희곡
202304,126,"나와 스크러피, 그리고 바다","앤서니 브라운 지음, 장미란 옮김",웅진주니어,유아
202305,126,죽음의 역사,"앤드루 도이그 지음, 석혜미 옮김",브론스테인,역사
202306,126,최애의 아이 8,"아카사카 아카 지음, 요코야리 멘고 그림",대원씨아이(만화),만화
202307,126,히카루가 죽은 여름 1,"모쿠모쿠렌 지음, 송재희 옮김",디앤씨미디어(주)(D&C미디어),만화
202308,126,또 못 버린 물건들,은희경 지음,난다,에세이
202309,126,미국엄마와 함께하는 리얼 엄마표 영어,김캐서린 지음,노란우산,좋은부모
202310,126,연인 대본집 1,황진영 지음,김영사,예술/대중문화
202311,126,무명의 감정들,쑥 지음,딥앤와이드(Deep&WIde),에세이
202312,126,단 한 사람,최진영 지음,한겨레출판,소설/시/희곡
202203,126,카구야 님은 고백받고 싶어 21,아카사카 아카 지음,학산문화사(만화),만화
202204,126,거의 모든 것의 역사,"빌 브라이슨 지음, 이덕환 옮김",까치,과학
202205,126,진짜 쓰는 실무 엑셀,오빠두(전진권) 지음,제이펍,컴퓨터/모바일
202206,126,마이 브로큰 마리코,"히라코 와카 지음, 박소현 옮김",㈜소미미디어,만화
202207,126,ETS 토익 기출 VOCA 출제기관 공식수험서,ETS 지음,(주)YBM(와이비엠),외국어
202208,126,"차이나 쇼크, 한국의 선택",한청훤 지음,사이드웨이,사회과학
202209,126,나의 히어로 아카데미아 34,호리코시 코헤이 지음,서울미디어코믹스(서울문화사),만화
202210,126,최소한의 이웃,허지웅 지음,김영사,에세이
202211,126,세월,"아니 에르노 지음, 신유진 옮김",1984Books,소설/시/희곡
202212,126,마법천자문 56,"유대영 지음, 정수영 그림, 강용철 감수",아울북,어린이
202401,127,세상은 이야기로 만들어졌다,"자미라 엘 우아실.프리데만 카릭 지음, 김현정 옮김",원더박스,인문학
202402,127,네임 스티커,황보나 지음,문학동네,청소년
202301,127,이 책은 돈 버는 법에 관한 이야기,고명환 지음,라곰,경제경영
202302,127,긴긴밤,루리 지음,문학동네,어린이
202303,127,순례 주택 (10만부 돌파 기념 스페셜 봄 에디션),유은실 지음,비룡소,청소년
202304,127,슬램덩크 신장재편판 3,이노우에 타케히코 지음,대원씨아이(만화),만화
202305,127,"비트코인, 그리고 달러의 지정학",오태민 지음,(주)거인의정원,경제경영
202306,127,최애의 아이 7,"아카사카 아카 지음, 요코야리 멘고 그림",대원씨아이(만화),만화
202307,127,수상한 놀이공원 천옥원,"히로시마 레이코 지음, 쟈쟈 그림, 김정화 옮김",길벗스쿨,어린이
202308,127,부의 추월차선 (10주년 스페셜 에디션),"엠제이 드마코 지음, 신소영 옮김",토트,경제경영
202309,127,타몬 군 지금 어느 쪽?! 4 (한정판),시와스 유키 지음,학산문화사(만화),만화
202310,127,해리 포터와 마법사의 돌 (미나리마 에디션),"J.K. 롤링 지음, 미나리마 그림, 강동혁 옮김",문학수첩,소설/시/희곡
202311,127,다!다!다! 애장판 (다다다) 4,"카와무라 미카 지음, 심이슬 옮김",서울미디어코믹스(서울문화사),만화
202312,127,ETS 토익 정기시험 기출문제집 1000 Vol. 3 Reading (리딩),ETS 엮음,(주)YBM(와이비엠),외국어
202203,127,달콩이네 떡집,"김리리 지음, 김이랑 그림",비룡소,어린이
202204,127,데일 카네기 인간관계론 (무삭제 완역본),"데일 카네기 지음, 임상훈 옮김",현대지성,자기계발
202205,127,돈그릇을 키우는 6가지 방법,김승현 지음,앤페이지,경제경영
202206,127,ETS 토익 단기 공략 750+ (LC + RC),ETS 지음,(주)YBM(와이비엠),외국어
202207,127,내가 틀릴 수도 있습니다,"비욘 나티코 린데블라드 지음, 토마스 산체스 그림, 박미경 옮김",다산초당,인문학
202208,127,박성우 시인의 이상한 낱말 사전,"박성우 지음, 서현 그림",비룡소,어린이
202209,127,내가 틀릴 수도 있습니다,"비욘 나티코 린데블라드 지음, 토마스 산체스 그림, 박미경 옮김",다산초당,인문학
202210,127,체인소 맨 11,후지모토 타츠키 지음,학산문화사(만화),만화
202211,127,유희왕 애장판 2,다카하시 카즈키 지음,대원씨아이(만화),만화
202212,127,여자아이 기억,"아니 에르노 지음, 백수린 옮김",레모,소설/시/희곡
202401,128,현대 심리치료와 상담 이론,권석만 지음,학지사,대학교재/전문서적
202402,128,데일 카네기 인간관계론 (무삭제 완역본),"데일 카네기 지음, 임상훈 옮김",현대지성,자기계발
202301,128,세상에서 가장 쉬운 본질육아 (러브드 에디션),지나영 지음,21세기북스,좋은부모
202302,128,5천만 원으로 시작하는 미라클 기적의 재개발 재건축,진와이스(장미진) 지음,리더스북,경제경영
202303,128,2023 이유진 국어 필사즉생 모의고사 백일기도 3 : 독해강화,이유진 지음,고시동네,수험서/자격증
202304,128,바람이 되어 살아낼게,유가영 지음,다른,청소년
202305,128,최재천의 공부 (리커버),최재천.안희경 지음,김영사,인문학
202306,128,총 균 쇠,"제레드 다이아몬드 지음, 강주헌 옮김",김영사,인문학
202307,128,최애의 아이 2,"아카사카 아카 지음, 요코야리 멘고 그림",대원씨아이(만화),만화
202308,128,연남동 빙굴빙굴 빨래방,김지윤 지음,팩토리나인,소설/시/희곡
202309,128,이서윤쌤의 초등한자어휘 일력 (스프링),"이서윤 지음, 오우성 그림",메가스터디북스,좋은부모
202310,128,365 원칙을 세우다 (스프링),유목민 지음,경이로움,자기계발
202311,128,다!다!다! 애장판 (다다다) 5,"카와무라 미카 지음, 심이슬 옮김",서울미디어코믹스(서울문화사),만화
202312,128,총 균 쇠,"제레드 다이아몬드 지음, 강주헌 옮김",김영사,인문학
202203,128,호호호,윤가은 지음,마음산책,에세이
202204,128,부동산 절세의 기술,"김동우.최왕규 지음, 송희창(송사무장) 감수",지혜로,경제경영
202205,128,이기적 유전자,"리처드 도킨스 지음, 홍영남.이상임 옮김",을유문화사,과학
202206,128,마블 스튜디오 엽서북 100,MARVEL 지음,아르누보,예술/대중문화
202207,128,부자 아빠 가난한 아빠 1 (20주년 특별 기념판),"로버트 기요사키 지음, 안진환 옮김",민음인,경제경영
202208,128,다섯번째 산,"파울로 코엘료 지음, 오진영 옮김",문학동네,소설/시/희곡
202209,128,나의 히어로 아카데미아 35,호리코시 코헤이 지음,서울미디어코믹스(서울문화사),만화
202210,128,체인소 맨 5,후지모토 타츠키 지음,학산문화사(만화),만화
202211,128,"비전 : 「빛」,「색」,「구성」으로 스토리를 전한다!","한스 P. 바커.사나탄 수리아반쉬 지음, 윤효원 옮김",잉크잼(잼스푼),예술/대중문화
202212,128,인듀어런스,"캐롤라인 알렉산더 지음, 김세중 옮김",뜨인돌,에세이
202401,129,물질의 세계,"에드 콘웨이 지음, 이종인 옮김",인플루엔셜(주),인문학
202402,129,마지막 마음이 들리는 공중전화,이수연 지음,클레이하우스,소설/시/희곡
202301,129,오늘의 일인분 일식,"베터홈 협회 지음, 이진숙 옮김",참돌,요리/살림
202302,129,천하제일 치킨쇼,"이희정 지음, 김무연 그림",비룡소,어린이
202303,129,설민석의 삼국지 대모험 11,"단꿈아이 지음, 스튜디오 담 그림",단꿈아이,어린이
202304,129,슬램덩크 신장재편판 6,이노우에 타케히코 지음,대원씨아이(만화),만화
202305,129,흔한남매 과학 탐험대 7 : 생물 1,"김덕영 그림, 김언정 외 글, 권경아 감수, 김희목 외 기획, 흔한남매 원작",주니어김영사,어린이
202306,129,최애의 아이 2,"아카사카 아카 지음, 요코야리 멘고 그림",대원씨아이(만화),만화
202307,129,제주도우다 1~3 세트 - 전3권,현기영 지음,창비,소설/시/희곡
202308,129,최선을 다하면 죽는다,황선우.김혼비 지음,문학동네,에세이
202309,129,그리스 로마 신화 35 : 로마를 지키려는 자,"박시연 지음, 최우빈 그림, 김헌 감수",아울북,어린이
202310,129,총 균 쇠,"제레드 다이아몬드 지음, 강주헌 옮김",김영사,인문학
202311,129,"울트라러닝, 세계 0.1%가 지식을 얻는 비밀","스콧 영 지음, 이한이 옮김",비즈니스북스,자기계발
202312,129,최애의 아이 1st 일러스트집 GlareＸSparkle 특별판,"아카사카 아카 지음, 요코야리 멘고 그림",대원씨아이(만화),만화
202203,129,박시백의 고려사 1,박시백 지음,휴머니스트,역사
202204,129,2022 해커스 GSAT 삼성직무적성검사 통합 기본서 최신기출유형 + 실전모의고사 (수리논리/추리),해커스 취업교육연구소 지음,챔프스터디,수험서/자격증
202205,129,김전일 37세의 사건부 11,"아마기 세이마루 지음, 사토 후미야 그림",서울미디어코믹스(서울문화사),만화
202206,129,떼인 근력 찾아드립니다,샤크 코치.에리카 코치 지음,위즈덤하우스,에세이
202207,129,저만치 혼자서,김훈 지음,문학동네,소설/시/희곡
202208,129,이어령의 마지막 수업,"김지수 지음, 이어령",열림원,인문학
202209,129,"돈의 속성 (300쇄 리커버 에디션, 양장)",김승호 지음,스노우폭스북스,경제경영
202210,129,"돈, 뜨겁게 사랑하고 차갑게 다루어라","앙드레 코스톨라니 지음, 한윤진 옮김",미래의창,경제경영
202211,129,귀멸 학원! 2,"호카미 나츠키 지음, 고토게 코요하루 원작",학산문화사(만화),만화
202212,129,돌봄과 작업,정서경 외 지음,돌고래,인문학
202401,130,봄의 폭풍과 몬스터 3,"미츠바치 미유키 지음, 이슬 옮김",학산문화사(만화),만화
202402,130,밥 프록터의 본 리치,"밥 프록터 지음, 김문주 옮김",비즈니스북스,자기계발
202301,130,나의 해방일지 일반판 1~4 세트 - 전4권,박해영 지음,오브제,예술/대중문화
