date,ranking,title,writer,press,kategorie
202401,179,광인,이혁진 지음,민음사,소설/시/희곡
202402,179,사는 동안 한 번은 팔아봐라,서 과장 지음,마인드셋,자기계발
202301,179,슬램덩크 오리지널 박스판 16~20 세트 - 전5권,이노우에 다케히코 지음,대원씨아이(만화),만화
202302,179,마법천자문 57,"유대영 지음, 정수영 그림, 강용철 감수",아울북,어린이
202303,179,그릿 GRIT (골드 에디션),"앤절라 더크워스 지음, 김미정 옮김",비즈니스북스,자기계발
202304,179,아주 위험한 과학책,"랜들 먼로 지음, 이강환 옮김",시공사,과학
202305,179,스즈메의 문단속 (양장),"신카이 마코토 지음, 민경욱 옮김",하빌리스,소설/시/희곡
202306,179,쓰이는 영문법 1,"김수영(셀리) 지음, Thomas Selley 감수",길벗이지톡,외국어
202307,179,블루 아카이브 오피셜 아트웍스,"신민섭 옮김, NEXON GAMES 감수",학산문화사(만화),만화
202308,179,학생회에도 구멍은 있다! 1,"무치마로 지음, 옷무 옮김",㈜소미미디어,만화
202309,179,원피스 105,오다 에이치로 지음,대원씨아이(만화),만화
202310,179,긴긴밤,루리 지음,문학동네,어린이
202311,179,설민석의 한국사 대모험 27,"설민석.스토리박스 지음, 정현희 그림, 강석화 감수",단꿈아이,어린이
202312,179,2025 해커스변호사 민법의 맥(脈),윤동환 지음,해커스변호사,수험서/자격증
202203,179,오늘의 일인분 일식,"베터홈 협회 지음, 이진숙 옮김",참돌,요리/살림
202204,179,프레임의 힘,"케네스 쿠키어 외 지음, 김경일 외 옮김",21세기북스,자기계발
202205,179,얼굴만으론 좋아할 수 없어요 3,"안자이 카린 지음, 이소연 옮김",서울미디어코믹스(서울문화사),만화
202206,179,내 마음의 위험한 녀석 6,"사쿠라이 노리오 지음, 조원로 옮김",㈜소미미디어,만화
202207,179,책들의 부엌,김지혜 지음,팩토리나인,소설/시/희곡
202208,179,"나, 프랜 리보위츠","프랜 리보위츠 지음, 우아름 옮김",문학동네,에세이
202209,179,조이라이드 : 당연하지만 함부로 말할수 없는 얘기 2,윤서인 지음,인라이트스쿨,사회과학
202210,179,소설 보다 : 가을 2022,김기태.위수정.이서수 지음,문학과지성사,소설/시/희곡
202211,179,설민석의 한국사 대모험 22,"설민석.스토리박스 지음, 정현희 그림, 강석화 감수",단꿈아이,어린이
202212,179,빈곤 과정,조문영 지음,글항아리,인문학
202401,180,긴긴밤,루리 지음,문학동네,어린이
202402,180,해커스 토익 LC Listening(리스닝) 기본서,David Cho 지음,해커스어학연구소(Hackers),외국어
202301,180,"돈, 뜨겁게 사랑하고 차갑게 다루어라","앙드레 코스톨라니 지음, 한윤진 옮김",미래의창,경제경영
202302,180,데일 카네기 자기관리론,"데일 카네기 지음, 임상훈 옮김",현대지성,자기계발
202303,180,나는 인생을 건 공부를 시작했다,이한나(츄발라) 지음,토네이도,자기계발
202304,180,10배의 법칙,"그랜트 카돈 지음, 최은아 옮김",부키,자기계발
202305,180,같이 가면 길이 된다,이상헌 지음,생각의힘,사회과학
202306,180,똥볶이 할멈 5,"강효미 지음, 김무연 그림",슈크림북,어린이
202307,180,"2023 큰별쌤 최태성의 별★별한국사 시대별 기출문제집 한국사능력검정시험 심화(1,2,3급)",최태성 지음,이투스북,수험서/자격증
202308,180,파리 세베이유,"가네코 요시아키 지음, 조수연 옮김",한즈미디어(한스미디어),요리/살림
202309,180,마흔에 읽는 쇼펜하우어,강용수 지음,유노북스,인문학
202310,180,익명의 독서 중독자들,"이창현 지음, 유희 그림",사계절,만화
202311,180,미우라 씨의 친구,"마스다 미리 지음, 박정임 옮김",이봄,만화
202312,180,대화의 정석,정흥수(흥버튼) 지음,FIKA(피카),자기계발
202203,180,룩 백,후지모토 타츠키 지음,학산문화사(만화),만화
202204,180,코스모스,"칼 세이건 지음, 홍승수 옮김",사이언스북스,과학
202205,180,내가 같이 뛰어내려 줄게,씨씨코 지음,다산북스,에세이
202206,180,아몬드 (반양장),손원평 지음,창비,청소년
202207,180,스파이 패밀리 5,엔도 타츠야 지음,학산문화사(만화),만화
202208,180,흔한남매 과학 탐험대 5 : 물리 1,"김덕영 그림, 이현진 외 글, 김희목 감수, 김희목 외 기획, 흔한남매 원작",주니어김영사,어린이
202209,180,공정하다는 착각,"마이클 샌델 지음, 함규진 옮김",와이즈베리,사회과학
202210,180,흔한남매 수수께끼 어드벤처 1,"도니패밀리 그림, 노지영 글, 흔한컴퍼니.정재형 감수, 흔한남매 원작",미래엔아이세움,어린이
202211,180,백만장자를 위한 공짜 음식 1,"이민진 지음, 유소영 옮김",인플루엔셜(주),소설/시/희곡
202212,180,체인소 맨 4,후지모토 타츠키 지음,학산문화사(만화),만화
202401,181,메리골드 마음 사진관,"윤정은 지음, 송지혜 북디자이너",북로망스,소설/시/희곡
202402,181,더 마인드 (10만 부 기념 코멘터리 북),하와이 대저택 지음,웅진지식하우스,자기계발
202301,181,인생의 허무를 어떻게 할 것인가,김영민 지음,사회평론아카데미,인문학
202302,181,해커스 보카 (Hackers Vocabulary),David Cho 지음,해커스어학연구소(Hackers),외국어
202303,181,회복탄력성 (15만부 기념 리커버),김주환 지음,위즈덤하우스,자기계발
202304,181,표류하는 세계,"스콧 갤러웨이 지음, 이상미 옮김",리더스북,경제경영
202305,181,데미안 (오리지널 초판본 표지디자인),"헤르만 헤세 지음, 이미영 옮김, 김선형",코너스톤,소설/시/희곡
202306,181,개의 설계사,단요 지음,아작,소설/시/희곡
202307,181,긴긴밤,루리 지음,문학동네,어린이
202308,181,수레바퀴 아래서 (오리지널 초판본 표지디자인),"헤르만 헤세 지음, 박지희 옮김, 김선형 해설",코너스톤,소설/시/희곡
202309,181,불편한 편의점 2 (단풍 에디션),김호연 지음,나무옆의자,소설/시/희곡
202310,181,블루 록 20,"노무라 유스케 지음, 카네시로 무네유키 원작",학산문화사(만화),만화
202311,181,나츠메 우인장 29,"미도리카와 유키 지음, 서현아 옮김",학산문화사(만화),만화
202312,181,2024 결국은 부동산,올라잇 칼럼니스트 23인 지음,원앤원북스,경제경영
202203,181,정의란 무엇인가 (특별 양장본),"마이클 샌델 지음, 김명철 옮김, 김선욱 감수",와이즈베리,인문학
202204,181,성공의 문을 여는 마스터키,"찰스 해낼 지음, 김우열 옮김",샨티,자기계발
202205,181,나도 세금 내는 아이가 될래요!,"옥효진 지음, 서정해 그림",청림Life,어린이
202206,181,스패로,"메리 도리아 러셀 지음, 정대단 옮김",황금가지,소설/시/희곡
202207,181,영원한 우정으로 1,"넬레 노이하우스 지음, 전은경 옮김",북로드,소설/시/희곡
202208,181,2023 써니 행정법총론 (기출지문 암기 App 이용쿠폰 제공) - 전2권,박준철 지음,지금(도서출판),수험서/자격증
202209,181,바로 쓰는 영어,"셀리 지음, Thomas W. Selley 감수",넥서스,외국어
202210,181,하반기 해커스 GSAT 삼성직무적성검사 실전모의고사 8회분 (수리논리/추리),해커스 취업교육연구소 지음,챔프스터디,수험서/자격증
202211,181,지구 끝의 온실,김초엽 지음,자이언트북스,소설/시/희곡
202212,181,체인소 맨 1,후지모토 타츠키 지음,학산문화사(만화),만화
202401,182,캠벨 생명과학,"Lisa A. Urry 외 지음, 전상학 옮김",바이오사이언스,대학교재/전문서적
202402,182,"사랑하라, 거짓된 천사들이여 1 (한정판)","Coco Uzuki 지음, 정효진 옮김",서울미디어코믹스(서울문화사),만화
202301,182,체인소 맨 7,후지모토 타츠키 지음,학산문화사(만화),만화
202302,182,모 이야기,최연주 지음,엣눈북스(atnoonbooks),소설/시/희곡
202303,182,고양이 해결사 깜냥 1,"홍민정 지음, 김재희 그림",창비,어린이
202304,182,거울 속 외딴 성 (영화 특별판),"츠지무라 미즈키 지음, 서혜영 옮김",알에이치코리아(RHK),소설/시/희곡
202305,182,히카루가 죽은 여름 1,"모쿠모쿠렌 지음, 송재희 옮김",디앤씨미디어(주)(D&C미디어),만화
202306,182,히카루가 죽은 여름 2,"모쿠모쿠렌 지음, 송재희 옮김",디앤씨미디어(주)(D&C미디어),만화
202307,182,진짜 쓰는 실무 엑셀,오빠두(전진권) 지음,제이펍,컴퓨터/모바일
202308,182,깨어있는 양육,"셰팔리 차바리 지음, 구미화 옮김",나무의마음,좋은부모
202309,182,"데일 카네기 인간관계론 (90주년 기념 개정증보판, 양장)","데일 카네기 지음, 이지연 옮김",다산북스,자기계발
202310,182,버전업! 굿모닝 독학 일본어 첫걸음,"정선영 지음, 오현정 감수",동양북스(동양문고),외국어
202311,182,AI 2024,김덕진 지음,스마트북스,경제경영
202312,182,그래서 이런 말이 생겼대요 : 우리말,"우리누리 지음, 송진욱 그림",길벗스쿨,어린이
202203,182,달러구트 꿈 백화점 (100만부 기념 합본호 기프트 에디션),이미예 지음,팩토리나인,소설/시/희곡
202204,182,체리새우 : 비밀글입니다,황영미 지음,문학동네,청소년
202205,182,고민의 답,글배우 지음,강한별,자기계발
202206,182,"칵테일, 러브, 좀비 (리커버)",조예은 지음,안전가옥,소설/시/희곡
202207,182,가끔씩 툭하고 러시아어로 부끄러워하는 옆자리의 아랴 양 2,"SUN SUN SUN 지음, 모모코 그림, 이승원 옮김",디앤씨미디어(주)(D&C미디어),소설/시/희곡
202208,182,오늘도 취향을 요리합니다,박미셸(it’s Michelle) 지음,서스테인,에세이
202209,182,해커스 토익 RC 리딩 READING,데이빗 조 (David Cho) 지음,해커스어학연구소(Hackers),외국어
202210,182,뇌를 깨우는 할로윈 숨은그림찾기,하이라이츠 편집부 지음,아라미kids,유아
202211,182,"오, 윌리엄!","엘리자베스 스트라우트 지음, 정연희 옮김",문학동네,소설/시/희곡
202212,182,다정한 것이 살아남는다,"브라이언 헤어.버네사 우즈 지음, 이민아 옮김, 박한선 감수",디플롯,과학
202401,183,내 말이 그 말이에요,김제동 지음,나무의마음,에세이
202402,183,2024 유휘운 행정법총론 실전동형 모의고사,유휘운 지음,메가스터디교육(공무원),수험서/자격증
202301,183,조국의 법고전 산책,조국 지음,오마이북,인문학
202302,183,2023 ADsP 데이터 분석 준전문가,윤종식 지음,데이터에듀,컴퓨터/모바일
202303,183,봇치·더·록! 4,하마지 아키 지음,대원씨아이(만화),만화
202304,183,"어린 왕자, 영원이 된 순간","앙투안 드 생텍쥐페리 지음, 이세진 옮김",위즈덤하우스,인문학
202305,183,참을 수 없는 존재의 가벼움,"밀란 쿤데라 지음, 이재룡 옮김",민음사,소설/시/희곡
202306,183,변비 탐정 실룩 1,"이나영 지음, 박소연 그림",북스그라운드,어린이
202307,183,또! 까면서 보는 해부학 만화,"압듈라 지음, 신동선 감수",한빛비즈,과학
202308,183,해커스 보카 (Hackers Vocabulary),David Cho 지음,해커스어학연구소(Hackers),외국어
202309,183,2023 ADsP 데이터 분석 준전문가,윤종식 지음,데이터에듀,컴퓨터/모바일
202310,183,다이어트 사이언스 2022,최겸 지음,린체인저스,건강/취미
202311,183,나는 정말 어디에 있는 걸까,"요시타케 신스케 지음, 권남희 옮김",주니어김영사,어린이
202312,183,디케의 눈물,조국 지음,다산북스,사회과학
202203,183,오십에 읽는 논어,최종엽 지음,유노북스,인문학
202204,183,어떻게 물리학을 사랑하지 않을 수 있을까?,"짐 알칼릴리 지음, 김성훈 옮김",윌북,과학
202205,183,설민석의 한국사 대모험 20,"설민석.스토리박스 지음, 정현희 그림, 강석화 감수",아이휴먼,어린이
202206,183,원피스 101,오다 에이치로 지음,대원씨아이(만화),만화
202207,183,데일 카네기 자기관리론,"데일 카네기 지음, 임상훈 옮김",현대지성,자기계발
202208,183,2023 시나공 총정리 컴퓨터활용능력 1급 필기 (8절),길벗R&D.강윤석 외 지음,길벗,컴퓨터/모바일
202209,183,마법천자문 53,"유대영 지음, 홍거북 그림, 김창환 감수",아울북,어린이
202210,183,한국 교회 트렌드 2023,지용근 외 지음,규장(규장문화사),종교/역학
202211,183,수학의 위로,"마이클 프레임 지음, 이한음 옮김",디플롯,인문학
202212,183,이어령의 마지막 수업,"김지수 지음, 이어령",열림원,인문학
202401,184,도파민네이션,"애나 렘키 지음, 김두완 옮김",흐름출판,인문학
202402,184,2024 문동균 한국사 문단속 적중 최종병기 Final 모의고사,문동균 지음,에스티유니타스,수험서/자격증
202301,184,체인소 맨 8,후지모토 타츠키 지음,학산문화사(만화),만화
202302,184,"아무튼, 현수동",장강명 지음,위고,에세이
202303,184,체리새우 : 비밀글입니다 (30만 부 리커버 특별판),황영미 지음,문학동네,청소년
202304,184,무조건 합격하는 암기의 기술,이윤규 지음,더퀘스트,자기계발
202305,184,헌터x헌터 HunterXHunter 신장판 37,토가시 요시히로 지음,학산문화사(만화),만화
202306,184,home,나카무라 아스미코 지음,조은세상(북두),만화
202307,184,2024 강해준 경찰학 전범위 모의고사,강해준 지음,새시대,수험서/자격증
202308,184,목욕탕 도감,"엔야 호나미 지음, 네티즌 나인 옮김",수오서재,에세이
202309,184,우리는 모두 죽는다는 것을 기억하라,"웨인 W. 다이어 지음, 정지현 옮김",토네이도,자기계발
202310,184,마법의 연금 굴리기,김성일 지음,에이지21,경제경영
202311,184,"사쿠라, 사쿠. 8","사키사카 이오 지음, 장혜영 옮김",서울미디어코믹스(서울문화사),만화
202312,184,이주하는 인류,"샘 밀러 지음, 최정숙 옮김",미래의창,역사
202203,184,그림들,SUN 도슨트 지음,나무의마음,예술/대중문화
202204,184,한국 SF 명예의 전당,김보영 외 지음,아작,소설/시/희곡
202205,184,잘 살아라 그게 최고의 복수다,권민창 지음,마인드셋,자기계발
202206,184,경찰 헌법도약 시험장노트,이국령 지음,윌비스(미래와사람 한림법학원),수험서/자격증
202207,184,지리의 힘 2,"팀 마샬 지음, 김미선 옮김",사이,사회과학
202208,184,이세계 삼촌 7,"호톤도신데이루 지음, 김민준 옮김",영상출판미디어(주),만화
202209,184,ETS 토익 단기 공략 750+ (LC + RC),ETS 지음,(주)YBM(와이비엠),외국어
202210,184,코스모스,"칼 세이건 지음, 홍승수 옮김",사이언스북스,과학
202211,184,2022 김승옥문학상 수상작품집,편혜영 외 지음,문학동네,소설/시/희곡
202212,184,지적 대화를 위한 넓고 얕은 지식 : 제로 편,채사장 지음,웨일북,인문학
202401,185,팔견전 18,"아베 미유키 지음, 박소현 옮김",㈜소미미디어,만화
202402,185,추리소설로 철학하기,백휴 지음,나비클럽,인문학
202301,185,체인소 맨 6,후지모토 타츠키 지음,학산문화사(만화),만화
202302,185,금리의 역습,"에드워드 챈슬러 지음, 임상훈 옮김",위즈덤하우스,경제경영
202303,185,지적 대화를 위한 넓고 얕은 지식 : 제로 편,채사장 지음,웨일북,인문학
202304,185,"80년대생 학부모, 당신은 누구십니까",이은경 지음,아워미디어,경제경영
202305,185,세상의 마지막 기차역 (리커버 에디션),"무라세 다케시 지음, 김지연 옮김",모모,소설/시/희곡
202306,185,꽂히는 글쓰기,"조 비테일 지음, 신현승 옮김",나비의활주로,자기계발
202307,185,"데일 카네기 인간관계론 (90주년 기념 개정증보판, 양장)","데일 카네기 지음, 이지연 옮김",다산북스,자기계발
202308,185,알아차림에 대한 알아차림,"루퍼트 스파이라 지음, 김주환 옮김",퍼블리온,인문학
202309,185,구슬쌤의 예의 바른 영어 표현에 더하여,구슬 지음,사람in,외국어
202310,185,타키 포오의 코믹 어드벤처 3,"김규태 그림, 안도감 글, 캐릭온TV 원작",대원키즈,어린이
202311,185,2024 맘마미아 가계부,맘마미아 지음,진서원,요리/살림
202312,185,다이아몬드 에이스 ACT2 : 34,테라지마 유지 지음,학산문화사(만화),만화
202203,185,나쁜 말 사전,"박효미 지음, 김재희 그림",사계절,어린이
202204,185,내가 틀릴 수도 있습니다,"비욘 나티코 린데블라드 지음, 토마스 산체스 그림, 박미경 옮김",다산초당,인문학
202205,185,소년이 온다,한강 지음,창비,소설/시/희곡
202206,185,장면들,손석희 지음,창비,사회과학
202207,185,마음의 법칙,"폴커 키츠.마누엘 투쉬 지음, 김희상 옮김",포레스트북스,인문학
202208,185,우리 아기 오감발달 시원한 바닷가 사운드북,"샘 태플린 지음, 페데리카 아이오사 그림",어스본코리아,유아
202209,185,털실타래 Vol.1 (2022년 가을호),"일본보그사 지음, 강수현 외 옮김",한즈미디어(한스미디어),건강/취미
202210,185,아포리아 시즌 1 : 1~2 세트  - 전2권,선태 지음,곁(beside),만화
202211,185,나의 문화유산답사기 9 : 서울편 1,유홍준 지음,창비,인문학
202212,185,명탐정 코난 : 제로의 일상 1,"아라이 타카히로 지음, 아오야마 고쇼 원작",서울미디어코믹스(서울문화사),만화
202401,186,역사를 바꾼 100책,EBS 독서진흥 자문위원회 지음,EBS BOOKS,인문학
202402,186,믹스 MIX 21,"아다치 미츠루 지음, 강동욱 옮김",대원씨아이(만화),만화
202301,186,비상식적 성공 법칙,"간다 마사노리 지음, 서승범 옮김",생각지도,자기계발
202302,186,2023 이동기 영어 기적의 특강,이동기 지음,에스티유니타스,수험서/자격증
202303,186,세컨드 브레인,"티아고 포르테 지음, 서은경 옮김",쌤앤파커스,자기계발
202304,186,"괜찮아, 그 길 끝에 행복이 기다릴 거야",손미나 지음,코알라컴퍼니,에세이
202305,186,괴수 8호 9 (일러스트 카드 + 스페셜 일러스트 카드 2종 포함 특장판),"마츠모토 나오야 지음, 유유리 옮김",서울미디어코믹스(서울문화사),만화
202306,186,"칩 워, 누가 반도체 전쟁의 최후 승자가 될 것인가","크리스 밀러 지음, 노정태 옮김",부키,경제경영
202307,186,채소 식탁,김경민 지음,래디시,요리/살림
202308,186,클루지 (리커버 에디션),"개리 마커스 지음, 최호영 옮김",갤리온,인문학
202309,186,유현준의 인문 건축 기행,유현준 지음,을유문화사,인문학
202310,186,바다가 들리는 편의점 2,"마치다 소노코 지음, 황국영 옮김",모모,소설/시/희곡
202311,186,커리어 그리고 가정,"클라우디아 골딘 지음, 김승진 옮김",생각의힘,사회과학
202312,186,바다가 들리는 편의점 (겨울 한정판 에디션),"마치다 소노코 지음, 황국영 옮김",모모,소설/시/희곡
202203,186,사피엔스 (무선본),"유발 하라리 지음, 조현욱 옮김, 이태수 감수",김영사,인문학
202204,186,어린이라는 세계 (어린이날 100주년 기념 리커버 특별판),김소영 지음,사계절,에세이
202205,186,가불 선진국,조국 지음,메디치미디어,사회과학
202206,186,2022 시나공 컴퓨터활용능력 1급 필기,길벗 R&D 외 지음,길벗,컴퓨터/모바일
202207,186,2023 시나공 총정리 컴퓨터활용능력 1급 필기 (8절),길벗R&D.강윤석 외 지음,길벗,컴퓨터/모바일
202208,186,털실타래 Vol.1 (2022년 가을호),"일본보그사 지음, 강수현 외 옮김",한즈미디어(한스미디어),건강/취미
202209,186,푸른 사자 와니니,"이현 지음, 오윤화 그림",창비,어린이
202210,186,흑뢰성,"요네자와 호노부 지음, 김선영 옮김",리드비,소설/시/희곡
202211,186,털실타래 Vol.2 (2022년 겨울호),"일본보그사 지음, 강수현 외 옮김",한즈미디어(한스미디어),건강/취미
202212,186,해커스 보카 (Hackers Vocabulary),David Cho 지음,해커스어학연구소(Hackers),외국어
202401,187,제정신이라는 착각,"필리프 슈테르처 지음, 유영미 옮김",김영사,인문학
202402,187,돈의 심리학 (30만 부 기념 스페셜 에디션),"모건 하우절 지음, 이지연 옮김",인플루엔셜(주),경제경영
202301,187,장단기 투자의 비밀,"래리 윌리엄스 지음, 이은주 옮김, 성전 감수",이레미디어,경제경영
202302,187,슬램덩크 완전판 프리미엄 박스판 21~24권 세트 - 전4권,이노우에 다케히코 지음,대원씨아이(만화),만화
202303,187,거의 모든 일상 표현의 영어,케빈 강.해나 변 지음,사람in,외국어
202304,187,리바운드 대본집,권성휘.김은희.장항준 지음,빚은책들,예술/대중문화
202305,187,회복탄력성 (15만부 기념 리커버),김주환 지음,위즈덤하우스,자기계발
202306,187,지적 대화를 위한 넓고 얕은 지식 1,채사장 지음,웨일북,인문학
202307,187,낭만 강아지 봉봉 4,"홍민정 지음, 김무연 그림",다산어린이,어린이
202308,187,인류보호회사 1~5 세트 - 전5권,짤짤이 지음,시공사,소설/시/희곡
202309,187,흔한남매 과학 탐험대 8 : 생물 2,"김덕영 그림, 김언정 외 글, 권경아 감수, 김희목 외 기획, 흔한남매 원작",주니어김영사,어린이
202310,187,"2024 경찰실무종합 오함마 응용문제집 총론, 각론 세트 - 전2권",오현웅 지음,경찰공제회,수험서/자격증
202311,187,부자의 그릇,"이즈미 마사토 지음, 김윤수 옮김",다산북스,경제경영
202312,187,고양이만큼만 욕심내는 삶,"요로 다케시 지음, 이지수 옮김",허밍버드,에세이
202203,187,"찾았다, 내 편",지수 지음,유영,에세이
202204,187,공정하다는 착각 (특별 양장본),"마이클 샌델 지음, 함규진 옮김",와이즈베리,사회과학
202205,187,지리의 힘,"팀 마샬 지음, 김미선 옮김",사이,사회과학
202206,187,10배의 법칙,"그랜트 카돈 지음, 최은아 옮김",부키,자기계발
202207,187,박혜원 파워토익 VOCA,박혜원 지음,(주)YBM(와이비엠),외국어
202208,187,이순신의 바다,황현필 지음,역바연,역사
202209,187,마흔에 읽는 니체,장재형 지음,유노북스,인문학
202210,187,이어령의 마지막 수업,"김지수 지음, 이어령",열림원,인문학
202211,187,"칵테일, 러브, 좀비 (리커버)",조예은 지음,안전가옥,소설/시/희곡
202212,187,나의 월급 독립 프로젝트 (리마스터 에디션),유목민 지음,리더스북,경제경영
202401,188,내면소통 (10만 부 기념 내면소통 워크북),김주환 지음,인플루엔셜(주),인문학
202402,188,총 균 쇠,"제레드 다이아몬드 지음, 강주헌 옮김",김영사,인문학
202301,188,전지적 독자 시점 Part 2 & 3 : 굿즈키트 세트 - 전6권,싱숑 지음,비채,소설/시/희곡
202302,188,백년 허리 1 : 진단편,정선근 지음,언탱글링,건강/취미
202303,188,전태일평전,조영래 지음,아름다운전태일(전태일기념사업회),사회과학
202304,188,진화하는 언어,"모텐 H. 크리스티안센.닉 채터 지음, 이혜경 옮김",웨일북,인문학
202305,188,미드나잇 뮤지엄 : 파리,박송이 지음,빅피시,예술/대중문화
202306,188,구미호뎐 1938 상·하 세트 - 전2권,한우리 지음,너와숲,예술/대중문화
202307,188,데일 카네기 인간관계론 (무삭제 완역본),"데일 카네기 지음, 임상훈 옮김",현대지성,자기계발
202308,188,전쟁과 죄책,"노다 마사아키 지음, 서혜영 옮김",또다른우주,인문학
202309,188,신기한 스쿨버스 어드벤처 1,"앤마리 앤더슨 지음, 아트풀 두들러스 그림, 이한음 옮김",비룡소,어린이
202310,188,생각이 너무 많은 어른들을 위한 심리학 (10만 부 기념 스페셜 에디션),김혜남 지음,메이븐,인문학
202311,188,지적 대화를 위한 넓고 얕은 지식 1,채사장 지음,웨일북,인문학
202312,188,이토록 멋진 인생이라니,"모리 슈워츠 지음, 공경희 옮김",나무옆의자,인문학
202203,188,이건희 컬렉션,SUN 도슨트 지음,서삼독,예술/대중문화
202204,188,픽사 스토리텔링,"매튜 룬 지음, 박여진 옮김",현대지성,경제경영
202205,188,2022 이동기 영어 실전동형 모의고사 Vol.2 - 전2권,이동기 지음,에스티유니타스,수험서/자격증
202206,188,이기적 유전자,"리처드 도킨스 지음, 홍영남.이상임 옮김",을유문화사,과학
202207,188,해커스 토익 스타트 RC Reading (리딩) 입문서,David Cho 지음,해커스어학연구소(Hackers),외국어
